{
  "id": "sdk.check-sdk-servicing-status",
  "edition": "11.0",
  "title": "Check the selected SDK for cached security and support warnings",
  "goal": "Enable SDK vulnerability and end-of-life warnings when selecting a development kit, while distinguishing missing or stale cached metadata from a current security assessment.",
  "areas": [
    "sdk"
  ],
  "exampleLanguages": [
    "csharp"
  ],
  "tags": [
    "skylark-build",
    "check-sdk-servicing-status"
  ],
  "apis": [
    "CheckSdkVulnerabilities",
    "NETSDK1238",
    "NETSDK1239",
    "DOTNET_CLI_HOME"
  ],
  "introducedIn": "11.0",
  "supportedTargets": [
    "11.0"
  ],
  "stability": "stable",
  "applicability": {
    "routes": [
      {
        "target": "11.0",
        "conditional": false,
        "usage": "primary",
        "selectionNotes": [
          "SDK 11 build task; Windows x64 execution evidence. Controlled cached metadata is not a live advisory check.",
          "Missing, corrupt and stale metadata never establish a clean security result; NuGetAudit is separate."
        ],
        "requirements": {
          "runtime": {
            "name": ".NET",
            "version": "11.0",
            "match": "release-family",
            "reason": "Declared net11.0 application/runtime; the SDK host is selected independently."
          },
          "sdk": {
            "name": ".NET SDK",
            "version": "11.0",
            "match": "release-family",
            "reason": "SDK family supplying the authored build contract; exact RC2 build is recorded evidence, not GA qualification."
          },
          "language": {
            "name": "C#",
            "version": "15.0",
            "match": "exact",
            "reason": "Supported language setting for these net11.0 examples; no preview-language switch."
          },
          "frameworks": [],
          "packages": [],
          "packageAssets": [],
          "workloads": [],
          "providers": [],
          "platforms": [
            "Windows x64; no other OS, architecture, device or rendering route is qualified."
          ],
          "renderingModes": [],
          "prerequisites": [
            "Complete SDK/runtime installations; tested SDK10 10.0.402/runtime10.0.13 and SDK11 11.0.100-rc.2.26504.105/runtime11.0.0-rc.2.26504.105.",
            "PowerShell 7 for the authoring checks. Restore setup may need nuget.org; served guidance is embedded offline."
          ],
          "constraints": [
            "SDK 11 build task; Windows x64 execution evidence. Controlled cached metadata is not a live advisory check.",
            "Missing, corrupt and stale metadata never establish a clean security result; NuGetAudit is separate.",
            "Older samples are comparisons, not additional target-10 editions or foundations. No provider, UI rendering, optional workload, production resource or public publication is involved."
          ],
          "optIns": [],
          "stabilityLimitations": [
            "Evidence is .NET 11 RC2. Reconcile actual GA artifacts separately under PIN-963; no API taught here is designated experimental."
          ]
        },
        "sourceUrls": [
          "https://github.com/dotnet/dotnet/blob/820230c386db5b0106c5430b3e5aee92a7826bf5/src/sdk/src/Tasks/Microsoft.NET.Build.Tasks/CheckSdkVulnerabilities.cs",
          "https://github.com/dotnet/dotnet/blob/820230c386db5b0106c5430b3e5aee92a7826bf5/src/sdk/src/Tasks/Microsoft.NET.Build.Tasks/targets/Microsoft.NET.SdkVulnerabilityCheck.targets",
          "https://learn.microsoft.com/en-us/dotnet/core/tools/global-json",
          "https://dotnet.microsoft.com/en-us/platform/support/policy/dotnet-core"
        ],
        "evidenceSamples": [
          "samples/net11.0/SkylarkServicing/SkylarkServicing.csproj"
        ]
      }
    ]
  },
  "sources": [
    {
      "title": "Pinned actual SDK implementation and build contract",
      "url": "https://github.com/dotnet/dotnet/blob/820230c386db5b0106c5430b3e5aee92a7826bf5/src/sdk/src/Tasks/Microsoft.NET.Build.Tasks/CheckSdkVulnerabilities.cs"
    },
    {
      "title": "Official source or supported deployment guidance",
      "url": "https://github.com/dotnet/dotnet/blob/820230c386db5b0106c5430b3e5aee92a7826bf5/src/sdk/src/Tasks/Microsoft.NET.Build.Tasks/targets/Microsoft.NET.SdkVulnerabilityCheck.targets"
    },
    {
      "title": "Official source or supported deployment guidance",
      "url": "https://learn.microsoft.com/en-us/dotnet/core/tools/global-json"
    },
    {
      "title": "Official source or supported deployment guidance",
      "url": "https://dotnet.microsoft.com/en-us/platform/support/policy/dotnet-core"
    }
  ],
  "evidence": [
    {
      "kind": "compile-and-run",
      "sample": "samples/net10.0/SkylarkServicing/SkylarkServicing.csproj",
      "target": "net10.0",
      "sdk": "10.0.402",
      "language": "14.0",
      "scope": "Real build/run and controlled cached vulnerability, EOL, clear, missing, stale and corrupt metadata through actual restore/build; no live advisory verdict."
    },
    {
      "kind": "compile-and-run",
      "sample": "samples/net11.0/SkylarkServicing/SkylarkServicing.csproj",
      "target": "net11.0",
      "sdk": "11.0.100-rc.2.26504.105",
      "language": "15.0",
      "scope": "Real build/run and controlled cached vulnerability, EOL, clear, missing, stale and corrupt metadata through actual restore/build; no live advisory verdict."
    }
  ],
  "snippets": {
    "older": {
      "path": "samples/net10.0/SkylarkServicing/SkylarkServicing.csproj",
      "region": "project",
      "language": "xml"
    },
    "newer": {
      "path": "samples/net11.0/SkylarkServicing/SkylarkServicing.csproj",
      "region": "project",
      "language": "xml"
    },
    "program": {
      "path": "samples/net10.0/SkylarkServicing/Program.cs",
      "region": "servicing",
      "language": "csharp"
    }
  },
  "humanProof": {
    "status": "not-required",
    "scope": "Bounded local Windows x64 behavior is executed by the agent. No Human/device/provider/other-platform behavior or GA/publication gate is claimed."
  }
}
